id,source,type,date,rating,title,text,author,url
ddc2e48a35da3f25,Reddit,discussion,2025-05-15T05:10:09+00:00,,Ew what is this new playlist layout?,"Got hit with the AB testing today, noticed the create button showed up on my profile which sucked. Created a new playlist on top of it, and this new layout is HORRIBLE. They made playlist picture tiny, there’s literally 2 edit buttons right next to each other LOL. Anyone else notice this horrible UI change? What’s even worse is when i go to my playlists created before this update. It keeps the old layout lmao i guess it just applies to future and new playlist created 😭 (See second photo for reference)",muad_dibb1,https://www.reddit.com/r/truespotify/comments/1kn07e2/ew_what_is_this_new_playlist_layout/
0fd4b459206373b1,Reddit,discussion,2025-05-15T04:29:33+00:00,,"Spotify never deletes playlists? How does this work? (dev, SWE oriented question)","I noticed that after 90 days, a playlist I had deleted was still visible, my name as author, accessed by a previously saved link. API requests confirmed it was still on server (ofc). [API Documentation](https://developer.spotify.com/documentation/web-api/concepts/playlists#following-and-unfollowing-a-playlist) states: ""We have no endpoint for deleting a playlist in the Web API; the notion of deleting a playlist is not relevant within the Spotify’s playlist system. Even if you are the playlist’s owner and you choose to manually remove it from your own list of playlists, you are simply unfollowing it."" Does anyone have evidence that their playlists were actually deleted (or usernames anonymized etc)?",TheAleph-1,https://www.reddit.com/r/truespotify/comments/1kmzj73/spotify_never_deletes_playlists_how_does_this/
106405b479ffdcf2,Reddit,discussion,2025-05-15T04:10:10+00:00,,"Karoo 3, Coming From Wahoo","Hey guys. I have some questions I'm hoping can get answered by those that actually have real world experience. First, I've used Garmin before and have stuck with Wahoo for the past 9 years. After my recent experience with the readability (lack of) on their new Roam v3, I feel the company went backwards (new computer was returned for a refund after only a few days, it sucks!). So much so, I'd never thought I'd ever consider Karoo. Why? I met a few cyclists back in 2021-2022 that were running Karoo (may have been Karoo 1 or 2 as 3 hadn't been released yet) who would just have the stupidest bugs and Wahoo would just work. I couldn't' handle dealing with some of the most basic features having glitches. With that said, I've watched dozens of videos and reviews recently and hear nothing but good things but have questions: 1. If you had a Wahoo device, what has kept you with Karoo 2. Ki2 app for Karoo 3, is that working? Can you change a page with the shifter lever using Shimano? 3. How's re-routing (maybe compared to Wahoo) 4. Has elevation data been improved (heard there were issues with that). 5. What's the realistic battery life these days? 6. Spotify capabilities like Wahoo (dedicated music page to change the song/volume) 7. When's the best time to get one, deals, suggestions. I greatly appreciate anyone answering as I know my post is lengthy but as I said before, I'm making quite a platform jump as I've been with Wahoo through 5 different devices but feel I'm finally done with them and ready to try something that seems to look more superior in UI.",jcapturedit,https://www.reddit.com/r/Karoo/comments/1kmz7cl/karoo_3_coming_from_wahoo/
80ffbd163e694a85,Reddit,discussion,2025-05-15T03:21:30+00:00,,Spotify is trying to woo me back… uhhh,"Spotify is offering starting 3 months for the price of just one month which is $12.69 then same price monthly from 4th month. In other words I’d be paying $4.23 per month for next 3 months… The price is tempting! But the reasons I switched from Spotify to YouTube Music earlier this year were: 1. Better algorithm over here. 2. Easy access to every freaking music video. 3. Ability for your playlists to have all kinds of audio and video. Regular YouTube being included is a nice little perk but I find myself using the music streaming service way more than regular YouTube. Some bugs and annoying things on YouTube Music aren’t present on Spotify though, which seems to be a more professional experience overall. 😩",dreamrdad7,https://www.reddit.com/r/YoutubeMusic/comments/1kmybt1/spotify_is_trying_to_woo_me_back_uhhh/
d705ffb155c53da8,Reddit,discussion,2025-05-15T02:14:16+00:00,,Spotify adding music?,"Spotify has started adding music to established playlists. These playlists are hours long with hundreds of songs. My partner and I have tried all methods of troubleshooting we can currently find online to get our Spotify to stop adding music to our playlists. We don’t have the setting to enhance playlists to even turn it on or off. We’re constantly turning off smart shuffle because it drives us nuts. We’ve searched and searched for it. This started pretty recently but it’s excruciating having to go through our playlists once a week to cull all the music Spotify added. We’re stuck, and debating just getting our music somewhere else. Anyone have any help?",the-hot-topical,https://www.reddit.com/r/truespotify/comments/1kmx1zt/spotify_adding_music/
f4fefa01d5bcfcdb,Reddit,discussion,2025-05-15T02:13:48+00:00,,"New to the art of rally on ps5, great cars and views 👌","I haven't really played a driving game since Gran Turismo 5 until I got into some classic Ridge Racers lately on the Playstation Plus library. I checked out what else they have from the racing genre and installed WRC Generations. So that's how the rally bug got me, but I kinda hate that there's no driving music when you mute the co-driver. Since I'm not on Spotify or Apple tunes I'm glad art of rally showed up on my radar pretty soon because this is the vibe I've been missing in my life... the colors, aesthetic, everything about it is lovely, and not a Pirelli label in sight. Really just sad that I'm 4 years late to the party.",Mattigator,https://www.reddit.com/r/artofrally/comments/1kmx1oa/new_to_the_art_of_rally_on_ps5_great_cars_and/
3205c3c2ff5d5375,Reddit,discussion,2025-05-15T00:23:46+00:00,,Ads or no ads?,I want to support the bug kings as best I can. I’m subbed to the Patreon but they’ve added an ad free tier. Is it worth listening to the non ad free version (on Spotify) so it looks better for sponsors even though I’m most likely to skip them? Yes it sounds counterintuitive but I thought it might help at least a little.,10_tacos,https://www.reddit.com/r/100percentEat/comments/1kmuwiz/ads_or_no_ads/
e770caee90793490,Reddit,discussion,2025-05-14T23:56:01+00:00,,Spotify add songs to playlist feature is broken,"Well not broken, but they removed quality of life features. What’s the opposite of when a company adds a feature for quality of life, you know, like they make an unnecessary change and make ease of use much harder and frustrating. Is it ragebaiting? Is it hostile design? That’s not the point. So the update rolls out and people are complaining, rightfully so. I have no major gripes with companies making ridiculous changes to justify the existence of their UI department, and trying to give the illusion of progress, mainly because every company does it (I’m looking at you Discord), just as long as they don’t ruin quality of life features. Well I just discovered that they broke the add button to editing and creating playlists. Here is my example: I’m making a new playlist. I want to add some songs from GNX. I hit the add button like I always do (now there’s an enhance button next to it that gives you recommended songs… you know, like the recommended songs list at the bottom of your playlist page). After hitting add, it gives me a list of suggested songs like always. And then I search Kendrick Lamar. Here is where things differ. I click the artist, and instead of taking me to a 1-1 of the artist’s page, they take me to a simplified version. Fine, so I can’t just click discography and view it all at once, now I have to decide whether to view singles, features, or albums, no big deal. I click albums, and click GNX. I realize all the songs are censored. Fine, I can just back out of this and search up GNX specifically. Find it uncensored, so all good. I click add to tv off, and it adds it and… takes me back to the suggested songs page. Seriously? I wasn’t done adding from that album. I remember being able to skim through albums and just add the songs I want in rapid succession. Now if I want to do that I either have to: search up GNX and every album name, and add the songs one at a time; go to the album in the regular search, and add them there which requires opening the drop down and finding the playlist to add it to; or the fastest way would be to use their stupid suggested songs page hoping they give you the right recommendations so you can just press the plus sign. That’s stupid. Also, just to note another thing we lost in the change: let’s say I’m under GNX (in the add somg view), and I want to navigate to kendrick’s page, I can’t press the artist’s name under the song anymore to navigate, as it will just start playing the song (trust me, this isn’t me lacking precision, I’ve tried numerous times). Another thing I just noticed which I thought was funny: I somehow managed to glitch the album arts so that my two GNX “recent searches” in the add view have the art of MMatBS and Damn. I also just noticed they don’t have the feature where while you’re adding songs to the playlist, of marking the songs you’ve already added by hiding the + button with a green check mark. So now, if you try to add a song already on the playlist, it will try to add it and have a pop up saying “blank is already in the playlist” AND SINCE IT TRIED TO ADD IT, IT WILL BACK YOU OUT OF THE ALBUM VIEW RIGHT BACK TO THE SUGGESTION VIEW. This is stupid. Is anyone collecting and tracking these issues, and/or is there a place to make bug reports? I assume Spotify is getting a lot of “feedback” regarding this update, I just wanted to know if anyone else is experiencing this, and where I should put mine.",toxic_fish_bowl,https://www.reddit.com/r/truespotify/comments/1kmuc2z/spotify_add_songs_to_playlist_feature_is_broken/
fb8190a58b0689fa,Reddit,discussion,2025-05-14T23:21:34+00:00,,Lists of things id like to see apple music implemented/ improve one day!,"You know, I've been having fun imagining what Apple could bring to iOS next! Here are some features I'd absolutely love to see integrated into Apple Music, perhaps in iOS 19 or a future update: * Universal Playback Control (like Spotify Connect): It's crucial to be able to hand off playback between my devices effortlessly—start on my iPhone, continue on my iPad, or control it playing on my TV without interruption. * Smarter Search: With Apple Intelligence, there's no excuse for Apple Music's search to fail on minor typos. Finding the music I want should be seamless. * A Proper Album View: I need a dedicated tab to see all my complete albums. Favoriting and filtering just doesn't cut it; I want a clear overview of my album collection. * Reliable Bug Fixes: The disappearing favorited albums issue is incredibly frustrating and has made me stop bothering with the feature altogether. Stability is key. * Meaningful Social Features: While I'm not after a TikTok clone, more ways to discover playlists from other Apple Music users and generally more social interaction would be a significant draw, similar to what keeps many on Spotify. * Global Stream Counts: Seeing the overall popularity of songs with a public stream count, like on Spotify, would be really interesting. * Smart Playlists on iPhone: The ability to create smart playlists directly on my iPhone is a feature I've wanted for a long time. * Custom Playlist Organization: I need to be able to sort my playlists in a way that makes sense to me, not just limited to the current filters. If iOS 19 (or future updates) delivered these improvements, I genuinely believe Apple Music would become the best music streaming service available. What are your impressions of these features, changes, or aspects of Apple Music? Looking ahead, what kind of new features or updates do you think would enhance the Apple Music experience?",EzraAtreides,https://www.reddit.com/r/AppleMusic/comments/1kmtm8a/lists_of_things_id_like_to_see_apple_music/
2410881f481392cc,Reddit,discussion,2025-05-14T22:21:52+00:00,,Need feedback if possible: Discover Music Artists Through Short-Form Content,"The problem: Most streaming platforms highlight big-name artists and rely heavily on algorithmic playlists. This means independent musicians often get overlooked. While platforms like TikTok are popular among Gen Z and Millennials for discovering music, they are not actually designed specifically for music discovery. Spotify has introduced Clips, which allow artists to upload short vertical videos to complement their music. However, this feature is still tied to existing releases and is not focused on discovery or supporting emerging artists as a primary goal. The idea: An app where users swipe through short clips from independent or emerging artists. Similar to TikTok in format, but completely focused on music. The goal is to help people find and connect with new artists. Users can swipe to discover music, follow artists, tip them, or add songs directly to their Spotify or Apple Music playlists. Artists can upload clips, link to full songs, promote gigs, sell merch, and more. Monetisation ideas: Ads for users and boosted posts for artists, with pricing kept affordable to support smaller artists. Why it’s different: Unlike TikTok, Instagram, or Spotify Clips, this app is purpose-built for discovering and supporting music creators. It is focused on music discovery and artist support rather than general content or promotion of established artists. Would you use an app like this to find music? If you are an artist, would you upload your content here? What features or tools would you like to see in such an app that would make it different from Spotify or other platforms? Thanks for reading.",Entrepreneur242,https://www.reddit.com/r/IndieFolk/comments/1kmsbze/need_feedback_if_possible_discover_music_artists/
da4b5f22e7aae06b,Reddit,discussion,2025-05-14T22:13:27+00:00,,"Almost dead, pls help?","Going through tough times. Running put of money, running out of energy antha aipoindi. Prasanthanga night nidra pattadam ledu, em cheyalo ardam kavadam ledu. Edavala ?navvala koppadala?? Music vintuu ala nidra poye vadini, spotify mod poindi, inka spotube tho adjust avtha continue ayyanu. Last week nundi spotube lo spotify playlists kanipiyatledu, work avvatledu. Anthey appati nundi music in my life is dead. The only source of escape in life poindi. Milo evaridaggara working spotify mods, or working spotube links untey pettandi...oka week antha ads vintu bathikesanu, I can't anymore !!",dank_samay,https://www.reddit.com/r/ask_Bondha/comments/1kms550/almost_dead_pls_help/
b15c682d10f9225e,Reddit,discussion,2025-05-14T21:51:52+00:00,,Why I feel done with spotify,"Been using the platform basically since it came out, I've had premium many times. The thing that eventually makes me cut my subscription, time after time, is that my play listing just gets totally screwed. I will play a song in one playlist, and when it's done, it's a gamble whether or not it will sequence to the next song as it should do, or just jump to random songs. It's suspicious to me that I can be listening to Cannibal Corpse, in a cannibal corpse playlist, and then right after ""Hammer Smashed Face"" is done playing, it'll play a Madonna song, or Taylor Swift. To make things more unpleasant, as a veteran user of the platform, when I cut my subscription, the only method of trying to bring me back is by pounding me with ads after every single song. I no longer get 30 min breaks from ads, I just get 3 ads per song. Granted, I've been such a long time user of the platform that I know how to manipulate the software to skip ads without any third party software involved. My playlists constantly jump around now, and I'm constantly having to reprimand the app for that. Constantly having to work around ads. I used to be all about torrenting music until spotify, but now I'm leaning towards cracked premium APKs and/or just simply downloading the music I love again.",Glad-Squash1290,https://www.reddit.com/r/spotify/comments/1kmrn9b/why_i_feel_done_with_spotify/
3b4a460d10a44a6b,Reddit,discussion,2025-05-14T21:51:05+00:00,,Discover Music Artists Through Short-Form Content,"The problem: Most streaming platforms highlight big-name artists and rely heavily on algorithmic playlists. This means independent musicians often get overlooked. While platforms like TikTok are popular among Gen Z and Millennials for discovering music, they’re not actually designed for music discovery. The idea: An app where users swipe through clips from independent or emerging artists. Similar to TikTok in format, but completely focused on music. The goal is to help people find and connect with new artists. Users can swipe to discover music, follow artists, tip them, or add songs directly to their Spotify or Apple Music playlists. Artists can upload clips, link to full songs, promote gigs, sell merch, and more. Monetisation ideas: Ads for users and boosted posts for artists: musicians can pay to promote their clips to more users. Pricing would be kept affordable to support smaller artists. Why it’s different: Unlike TikTok or Instagram, this app is purpose-built for discovering and supporting music creators. It’s focused. Would love your thoughts: Would you use an app like this to find music? If you're an artist, would you upload your content here? Thanks for reading.",Entrepreneur242,https://www.reddit.com/r/indie/comments/1kmrmla/discover_music_artists_through_shortform_content/
bfe22d238415cd97,Reddit,discussion,2025-05-14T21:48:03+00:00,,[UX Feedback] Would you use a “Save Queue as Playlist” feature on Spotify?,"Hi everyone, I’m exploring an idea based on a common behavior I’ve noticed in music apps — specifically Spotify. Users often build rich listening queues in the moment, combining: * Albums * Single tracks * Manually added songs …based on mood, setting, or social context. However, once the queue plays out, it’s lost — unless users manually rebuild it into a playlist. There’s currently no option to **save or share the current queue** as a playlist (especially with manually added songs preserved in order). **Problem:** Queues are often curated on-the-fly and reflect personal or social moments that are difficult to recreate. The lack of a ""Save Queue"" feature misses an opportunity to support user intent and memory. **Concept:** Introduce a **“Save Current Queue”** or **“Share Queue as Playlist”** option that: * Preserves the queue as-is (including user-added items) * Allows one-tap saving or sharing * Supports recall, sharing, and continuity in user listening behavior Would love to hear your thoughts: * Do you see value in this from a UX standpoint? * What edge cases or implementation challenges come to mind? * Have you seen effective examples of this in other platforms? Appreciate any perspectives!",Most_Floor_397,https://www.reddit.com/r/truespotify/comments/1kmrjzw/ux_feedback_would_you_use_a_save_queue_as/
1dc06c8a79e9d22d,Reddit,discussion,2025-05-14T21:47:18+00:00,,Discover Music Artists Through Short-Form Content,"The problem: Most streaming platforms highlight big-name artists and rely heavily on algorithmic playlists. This means independent musicians often get overlooked. While platforms like TikTok are popular among Gen Z and Millennials for discovering music, they’re not actually designed for music discovery. The idea: An app where users swipe through clips from independent or emerging artists. Similar to TikTok in format, but completely focused on music. The goal is to help people find and connect with new artists. Users can swipe to discover music, follow artists, tip them, or add songs directly to their Spotify or Apple Music playlists. Artists can upload clips, link to full songs, promote gigs, sell merch, and more. Monetisation ideas: Ads for users and boosted posts for artists: musicians can pay to promote their clips to more users. Pricing would be kept affordable to support smaller artists. Why it’s different: Unlike TikTok or Instagram, this app is purpose-built for discovering and supporting music creators. It’s focused. Would love your thoughts: Would you use an app like this to find music? If you're an artist, would you upload your content here? Any other monetisation ideas or possible challenges that come to mind? Thanks for reading.",Entrepreneur242,https://www.reddit.com/r/Entrepreneur/comments/1kmrjd5/discover_music_artists_through_shortform_content/
337cc67d38aec161,Reddit,discussion,2025-05-14T21:46:02+00:00,,Discover Music Artists Through Short-Form Content,"The problem: Most streaming platforms highlight big-name artists and rely heavily on algorithmic playlists. This means independent musicians often get overlooked. While platforms like TikTok are popular among Gen Z and Millennials for discovering music, they’re not actually designed for music discovery. The idea: An app where users swipe through clips from independent or emerging artists. Similar to TikTok in format, but completely focused on music. The goal is to help people find and connect with new artists. Users can swipe to discover music, follow artists, tip them, or add songs directly to their Spotify or Apple Music playlists. Artists can upload clips, link to full songs, promote gigs, sell merch, and more. Monetisation ideas: Ads for users and boosted posts for artists: musicians can pay to promote their clips to more users. Pricing would be kept affordable to support smaller artists. Why it’s different: Unlike TikTok or Instagram, this app is purpose-built for discovering and supporting music creators. It’s focused. Would love your thoughts: Would you use an app like this to find music? If you're an artist, would you upload your content here? Any other monetisation ideas or possible challenges that come to mind? Thanks for reading.",Entrepreneur242,https://www.reddit.com/r/SideProject/comments/1kmribo/discover_music_artists_through_shortform_content/
9f58c0858deabd37,Reddit,discussion,2025-05-14T21:44:15+00:00,,Discover Music Artists Through Short-Form Content,"Discover Music Artists Through Short-Form Content The problem: Most streaming platforms highlight big-name artists and rely heavily on algorithmic playlists. This means independent musicians often get overlooked. While platforms like TikTok are popular among Gen Z and Millennials for discovering music, they’re not actually designed for music discovery. The idea: An app where users swipe through clips from independent or emerging artists. Similar to TikTok in format, but completely focused on music. The goal is to help people find and connect with new artists. Users can swipe to discover music, follow artists, tip them, or add songs directly to their Spotify or Apple Music playlists. Artists can upload clips, link to full songs, promote gigs, sell merch, and more. Monetisation ideas: Ads for users and boosted posts for artists: musicians can pay to promote their clips to more users. Pricing would be kept affordable to support smaller artists. Why it’s different: Unlike TikTok or Instagram, this app is purpose-built for discovering and supporting music creators. It’s focused. Would love your thoughts: Would you use an app like this to find music? If you're an artist, would you upload your content here? Any other monetisation ideas or possible challenges that come to mind? Thanks for reading.",Entrepreneur242,https://www.reddit.com/r/AppIdeas/comments/1kmrgu0/discover_music_artists_through_shortform_content/
422746733d1bb2c5,Reddit,discussion,2025-05-14T21:42:33+00:00,,App idea – Discover Music Artists Through Short-Form Content,"Discover Music Artists Through Short-Form Content The problem: Most streaming platforms highlight big-name artists and rely heavily on algorithmic playlists. This means independent musicians often get overlooked. While platforms like TikTok are popular among Gen Z and Millennials for discovering music, they’re not actually designed for music discovery — it just happens there by chance. The idea: An app where users swipe through clips from independent or emerging artists. Similar to TikTok in format, but completely focused on music. The goal is to help people find and connect with new artists. Users can swipe to discover music, follow artists, tip them, or add songs directly to their Spotify or Apple Music playlists. Artists can upload clips, link to full songs, promote gigs, sell merch, and more. Monetisation ideas: Ads for users and boosted posts for artists: musicians can pay to promote their clips to more users. Pricing would be kept affordable to support smaller artists. Why it’s different: Unlike TikTok or Instagram, this app is purpose-built for discovering and supporting music creators. It’s focused — no viral dances, random memes, or unrelated content. Just short, engaging music clips. Would love your thoughts: Would you use an app like this to find music? If you're an artist, would you upload your content here? Any other monetisation ideas or possible challenges that come to mind? Thanks for reading.",Entrepreneur242,https://www.reddit.com/r/AppIdeas/comments/1kmrfd8/app_idea_discover_music_artists_through_shortform/
