id,source,type,date,rating,title,text,author,url
5cb3bb859dbdc0ac,Play Store,review,2026-06-19T17:16:49+00:00,1,1★ review,"I first would like to say i put in a rating in 2024 that disappeared, it was also one start because Spotify makes a set amount of songs you can choose, when you run out of these, you can't choose anything, meaning if you search a song amd play it, the song won't play, instead 15 other songs you don't like will play, it's been 2 years and my point still stands. fix your app, stop caring only about money, your a multimillion dollar company/app and you force people to pay for a subscription",Wesly Ellis,https://play.google.com/store/apps/details?id=com.spotify.music&reviewId=04c71453-083a-4f91-8a6a-061f443251ca
a60b67cad4bbe190,Play Store,review,2026-06-19T15:57:45+00:00,5,5★ review,"Spotify has quite recently added the ability to (un)filter playlists and radios so they aren't customized. I cannot express how important this is to me, personally, as this is a really fantastic way to discover and enjoy more music.",Tyler Briggs,https://play.google.com/store/apps/details?id=com.spotify.music&reviewId=6d98d155-80d8-46f2-805a-54e93be4e582
212ebf09a92613bf,Play Store,review,2026-06-19T15:01:00+00:00,5,5★ review,"I really love this app.. I love to hear songs while studying and this app helps me in the best way!! Spotify helps me to discover new songs. This has been the best part of my music journey! The 'Discover Weekly' and 'Daily Mixes' are pure magic. I’ve found more new favorite artists here than anywhere else.""""Spotify doesn't just play songs; it curates the perfect moments of your day.""""The recommendation engine is simply unmatched. It knows exactly what I love to play👍💕💖🤞",Raz The Mentor,https://play.google.com/store/apps/details?id=com.spotify.music&reviewId=a8112429-e2a2-4681-8fc0-14018680a0da
fc0cd873076e9157,Play Store,review,2026-06-19T13:57:28+00:00,5,5★ review,"Best music app for uncomplicated listening! The elapsed time between installation and sitting back to relaxed listening is about as short as it could be. I've had it installed for over a year now and so far it has found every album, song, artist, and genre I've searched for ......including the yodeling song by Frigid Pink! 9.5 thumbs up! Update June 19th, 2026: And after being a subscriber for many years now I can honestly say that it is the most used app that I have installed on my phone...",Saint Peter,https://play.google.com/store/apps/details?id=com.spotify.music&reviewId=33423c63-832b-4183-9f66-a0b53b815331
0d7f445e6b050a41,Play Store,review,2026-06-19T13:12:06+00:00,1,1★ review,"Devs don't understand that 10x more people (including me) would subscribe monthly for 2.99. Instead they only get 1/10th the subscribers at $12.99 and lose about 60% of what they otherwise could be making. Devs also don't understand that force shuffle AND ads are too much. It drives people off the app so they get less ad revenue. If they change subscription cost to 2.99 their sub revenue doubles. If they allow no shuffle, then ad revenue also goes up substantially.",Rob,https://play.google.com/store/apps/details?id=com.spotify.music&reviewId=91fa7061-cfe0-4f66-b8d7-98e6b0142f01
13068b2679ba1190,Play Store,review,2026-06-19T13:10:41+00:00,5,5★ review,I love this app. different genres of music in a single box,Patrick Adeniran,https://play.google.com/store/apps/details?id=com.spotify.music&reviewId=d39df1d3-adab-4a33-ae05-24ce0d08cb0b
968a7732203acec4,Play Store,review,2026-06-19T12:37:12+00:00,4,4★ review,"After the latest update,MUSIC FOR YOU option is not available and the music recommendation are not matching my GENRE,Had a chat with SPOTIFY agent but not much help.Please fix this issue at the earliest...",Richi Benjamin,https://play.google.com/store/apps/details?id=com.spotify.music&reviewId=831e3db6-528b-42c0-9419-441e106515fe
7ae4279ccd0da709,Play Store,review,2026-06-19T12:15:40+00:00,5,5★ review,I love how simple and useful this app is - highly recommended!,Faith Mutsambiwa,https://play.google.com/store/apps/details?id=com.spotify.music&reviewId=5fdd5722-c384-42d5-9d68-88d129fe1010
c135ebc331e5ff63,Play Store,review,2026-06-19T12:10:54+00:00,5,5★ review,Worthy of appreciation for your overall music coverage.,Temjen Jamir,https://play.google.com/store/apps/details?id=com.spotify.music&reviewId=aee65b32-cb9d-4372-b122-b0cef7cd8e25
a648c7983db23dcb,Play Store,review,2026-06-19T11:34:31+00:00,2,2★ review,keeps crashing on Thursdays when release radar comes out. app just closes suddenly.,Greg Woods,https://play.google.com/store/apps/details?id=com.spotify.music&reviewId=0027fd80-c288-4d6c-a4a8-986611ccdeb9
2480c73ec0c68027,Play Store,review,2026-06-19T10:22:37+00:00,5,5★ review,I really recommend this app to anyone I like the way a work and make me happy to have Spotify thanks and give a good use please 🙏,Roberto Naherajr,https://play.google.com/store/apps/details?id=com.spotify.music&reviewId=ae09c47a-4612-4f65-821c-f46efcc02003
a4b2f773a7f110c6,Play Store,review,2026-06-19T09:54:54+00:00,1,1★ review,when music is playing nothing there isn't a notification for it nor on my lock screen to skip,Maria Only,https://play.google.com/store/apps/details?id=com.spotify.music&reviewId=c803005b-118d-42e6-8999-144e4667ff2c
535e878c45f3bd33,Play Store,review,2026-06-19T09:46:04+00:00,1,1★ review,so bad or worst after few days it asks for premium and you can not play song of your choice even if you make playlist😠😡🤬you would face several long ads even in a 2min song,Pratima Namdeo,https://play.google.com/store/apps/details?id=com.spotify.music&reviewId=fc3df93a-cbad-4a7a-8b90-ee9f3d5b6325
3d593ef8565aa470,Play Store,review,2026-06-19T09:19:30+00:00,1,1★ review,"It's crazy how much the app degraded. You have a limited number of skips, advertisements every few minutes and now you can't even play the song you want or your songs in an order you want without premium. Better to avoid the app and use something like amazon music before your taste profile is already set.",Ragini,https://play.google.com/store/apps/details?id=com.spotify.music&reviewId=5cc684c2-3bc2-4b74-acbd-cbdc9d17e03b
1e4da244a8fe9bb9,Play Store,review,2026-06-19T07:59:48+00:00,5,5★ review,Love this app. So many great songs and Playlists. I love the fact that you can create your own personal radio stations based on the genre of music that you like 👍,Jamal Hurley,https://play.google.com/store/apps/details?id=com.spotify.music&reviewId=77d3ca2d-be09-49c3-b3e2-a8c0cecdca5f
3cca5c902814f3c9,Play Store,review,2026-06-19T07:57:58+00:00,2,2★ review,the free version is horrible I am unable to pay for premium features and I have to deal with the free version you only get 6 skips an hour you can't change the queue you can't go back to a previous song! ...at least give us the ability to change the queue + go back to the song that just played at least the ads are bearable for the most part tho edit: WHAT THE HELL I FOUND OUT THAT YOU CAN'T EVEN CHANGE THE ORDER OF THINGS YOU PUT IN THE QUEUE AT LEAST LET US CHANGE THE ORDER OF WHAT WE PUT IN 🙏,Arianna Donaldson,https://play.google.com/store/apps/details?id=com.spotify.music&reviewId=c4d9e1ea-78f5-40da-bf51-eef12f23ccd6
eec9d06834789419,Play Store,review,2026-06-19T07:52:45+00:00,1,1★ review,"Spotify has increased their prices too much. Request to bring back the price. I had switched to apple music. it provides affordable listening experience. with lossless music. but the suggestions in Spotify is good that i feel like coming back, if the cost is affordable",Sugan G,https://play.google.com/store/apps/details?id=com.spotify.music&reviewId=f1cdc8c3-40e5-4b60-8781-497aeb477d8f
b087592c3d938621,Play Store,review,2026-06-19T07:52:20+00:00,2,2★ review,"Basically everything it seems in the app at some point is blocked behind a paywall or just blocked in total like shuffle options and stuff like that, and 6 skips an hour? thats just bs. Prolly one of the only negative reviews and please FIX THE XBOX VERSION ITS SO BROKEN I DONT UNDERSTAND HOW YALL MADE IT!?!?!",Jack Hill (Just Jack),https://play.google.com/store/apps/details?id=com.spotify.music&reviewId=ab7a1249-8d6c-4d83-9f97-32ba1fa5e295
b8da9be451cf80d7,Play Store,review,2026-06-19T07:24:26+00:00,5,5★ review,10/10 do recommend. it has every song that I like,Toni Phillips,https://play.google.com/store/apps/details?id=com.spotify.music&reviewId=6c78f11c-a763-4b92-b303-fe1f1f01aeaa
87c1b17f2f2c4236,Play Store,review,2026-06-19T07:09:56+00:00,1,1★ review,Use to be the best but now with the dj and enhanced shuffle and other annoying things i cant trun off adds more lag as well as an increase in issues and problems with the app. So much irrelevant stuff now on the main page and I can't even find new music from artists that I follow anymore seems like a basic thing that should have stayed in the app No clue why they got rid of it but the moves that they're making make me want to move to a completely different music app rather than paying for this.,Austin Underwood,https://play.google.com/store/apps/details?id=com.spotify.music&reviewId=c774b9ce-b1f7-4760-b6ca-c04e518a23b0
634d590f7b2b6c6b,Play Store,review,2026-06-19T06:23:59+00:00,2,2★ review,Ive used the old widget 4 years n had no issue with it I used the widget more then the app shortcut when even i would just open the app when they came out with the new widget I had no interest in switching over cause I liked how the old one 1x4 worked n the new one was a 2x4 widget cause it gave you the option to open a Playlist I had no interest in the so I didnt switch now they forced me to switch now when I use the widget to open it im brought to a Playlist not the home screen i cant stand it,Jates,https://play.google.com/store/apps/details?id=com.spotify.music&reviewId=36a71672-a16c-402e-aeb6-9cabcc1cf7c5
a56d4160907537a5,Play Store,review,2026-06-19T06:17:19+00:00,5,5★ review,"Spotify is absolutely top rate when it comes to streaming all genres of music. And as far as prices go, you can't beat the quality & pricing that you get at Spotify. I refuse to use anything but Spotify !!!!!",Charles Martin,https://play.google.com/store/apps/details?id=com.spotify.music&reviewId=f332d7ce-2a79-4c81-8b5f-fe7294178d2a
3c0d1f34031a341f,Play Store,review,2026-06-19T05:30:29+00:00,1,1★ review,everything is behind a pay wall yes theirs some features but you have to pay for everything especially if you want to shuffle songs 🤦🏻‍♂️,Juan S,https://play.google.com/store/apps/details?id=com.spotify.music&reviewId=f69ab558-f5c8-4267-afa8-e743bf903a94
32720eb9a211f3ec,Play Store,review,2026-06-19T05:08:50+00:00,1,1★ review,"i cant play the SONGS IN ORDER. when i click on to playlists, the only thing i can choose is a short clip of the song like come on man, choosing should be a basic feature. but the thing is that this is not a prob in phones ig. This problem is in my tab I aint gonna hear any music from this app anymore. Youtube music is much better than this",Anna Maria Varghese,https://play.google.com/store/apps/details?id=com.spotify.music&reviewId=d1aa0f41-bcf1-4ccb-8a80-2f7b63f895e0
9ddd2528814b3bd9,Play Store,review,2026-06-19T04:58:33+00:00,2,2★ review,"Used to be my favorite app for listening to music, but not anymore. There are ads more than before, and the amount of features they've locked behind premium is absurd. Can't even listen to the same song twice consecutively without premium. Spotify is becoming a cash grab.",Yeori,https://play.google.com/store/apps/details?id=com.spotify.music&reviewId=d144bf3b-9444-4dd8-85fe-9d12da17fdac
49a6c51ad5533328,Play Store,review,2026-06-19T04:48:32+00:00,5,5★ review,Awesome way to find new music. The layout is awesome. Love it The best music app out there.,William Troy Roberts (B.T. or Hausscat),https://play.google.com/store/apps/details?id=com.spotify.music&reviewId=35fabfa6-3f53-4cd7-ba4c-186063bab2cb
3847ff76cbe45fc9,App Store,review,2026-06-19T04:30:35+00:00,4,Amazing,This app is amazing have good graphics it’s really good I am happy for finding this app I can create my own playlist is my favor part,Boostfer,https://itunes.apple.com/us/review?id=324684580&reviewId=14199941209
307695b532369d75,Play Store,review,2026-06-19T04:28:52+00:00,3,3★ review,"very happy they changed the adjustment for the speed to smaller steps possible... but the sleep timer still only these fixed few options to select from :( Spotify wrapped has sooooo much potential but is used so wrong, so little, so unlogical... so sad! having premium... then still having super loud ads in ""sleeping podcast"" thanks for nothing ... Almost falling asleep then Bämmm..",Paulina Hübschmann,https://play.google.com/store/apps/details?id=com.spotify.music&reviewId=625fc15a-aeba-41b2-b074-463f70355231
c9c8403db39db2de,App Store,review,2026-06-19T04:25:51+00:00,5,Great!!!,This app is great for kids and adults and premeuim is even better I highly recommend,So great I would recomrnd,https://itunes.apple.com/us/review?id=324684580&reviewId=14199930438
252412cabb54298d,App Store,review,2026-06-19T04:22:05+00:00,4,Ads,"I wish there were less ads and like if I have a playlist, I want it to go in the same order as the songs are. Thank you, have a nice day!! I loveee Spotify 👑👑",Ads & playlist,https://itunes.apple.com/us/review?id=324684580&reviewId=14199921803
7b1bf2703269003d,App Store,review,2026-06-19T04:17:11+00:00,3,This is the best app to use to listen to musics but one problem.,"This app is good to listen on but i had to take off two stars because after a couple listens to sone songs you choose it cost money to freely chose anything unlimitedly. Can’t it be free? And the skips too, I mean yea the app just doesn’t need to be payed to listen to unlimited musics but just add a donation button where people can donate. Thx, I maybe wrong but who knows :)",冷面女神,https://itunes.apple.com/us/review?id=324684580&reviewId=14199910391
f5e8a75cfe09c83c,Play Store,review,2026-06-19T04:01:17+00:00,2,2★ review,"Extremely disappointed, extremely money hungry. Cannot even move the music time bar and cannot even play the playlist down without having to pay for premium, YES they require premium to even disable shuffling.",REDACTED,https://play.google.com/store/apps/details?id=com.spotify.music&reviewId=381de611-43a9-4d63-862d-970610b265de
43fb20ca39ea7608,Play Store,review,2026-06-19T03:40:53+00:00,4,4★ review,"Hello, Spotify is a great platform and thank you. There are only two problems. 1) The ability to skip forward and backward is a very simple and obvious thing and please add a free version. 2) Add the ability to play music from there when I click on a part of the lyrics. All of this was there before, but in the updates, it was removed from the free version and became exclusive to the premium versions!!",Hsmf Hsmf,https://play.google.com/store/apps/details?id=com.spotify.music&reviewId=57a58772-9eca-46ee-8c59-933d8ab3241e
fb10900ce93fc4e2,Play Store,review,2026-06-19T03:30:19+00:00,3,3★ review,The DJ keeps playing Latin music despite me never listening to it and skipping it when it puts it on. This has been a problem for months now. I have been paying for premium for years now but still have to deal with this issue which is really frustrating.,Jeff R,https://play.google.com/store/apps/details?id=com.spotify.music&reviewId=6e2ac7c1-b63f-43d3-afce-632718728932
678b44416a1d5e3d,App Store,review,2026-06-19T03:30:12+00:00,2,Smart shuffle,Smart shuffle ruined Spotify because you can’t listen to the songs you want without going back to the app and changing it yourself,Noel pagan,https://itunes.apple.com/us/review?id=324684580&reviewId=14199801269
5e056322e5187ee3,App Store,review,2026-06-19T03:15:37+00:00,1,Plays same songs over and over,App won’t stop playing the same songs over and over within your playlist.,Angel Gamon,https://itunes.apple.com/us/review?id=324684580&reviewId=14199766002
ccdc9d291a8e4cc7,Play Store,review,2026-06-19T02:57:39+00:00,2,2★ review,"Radio option has become so unusable because of ""promotional tool for artists"" which increases likelihood of trash songs bring recommended.",Paulo,https://play.google.com/store/apps/details?id=com.spotify.music&reviewId=4b29d2ef-1065-470b-8430-34ea9affdaf7
f229b0e930b101e0,App Store,review,2026-06-19T02:54:28+00:00,5,.,The only thing is the shuffle!!!Omg so terrible,iccyjasmine,https://itunes.apple.com/us/review?id=324684580&reviewId=14199713680
211b31571fd87a9e,Play Store,review,2026-06-19T02:46:57+00:00,1,1★ review,"The new widget is horrible. it has less useful functions in the same amount of space at the expense of bigger album art, bigger logo, and spacing on the top and bottom. The skip buttons no longer appear on the smaller 1x5 widget. Very disappointing",Ben Hudson,https://play.google.com/store/apps/details?id=com.spotify.music&reviewId=53c3d18a-c383-4268-abb1-76b95874ba19
01da8769e59cc8c1,App Store,review,2026-06-19T02:45:32+00:00,2,Spotify,"It’s good if your paying 800$ a month (exaggeration). Money is tight right now and so we had to cancel paying for spotify and it turned into the worst app possible. everything is on “ shuffle” but it doesn’t even play the songs from the playlist you pick, it gives you “suggested” songs that are completely different. The ads are after EVERY song, and there’s two..Spotify if you see this, please change whatever you’re doing or lower prices. other then that i love the app a lot more then any other music apps.",please work out your problems,https://itunes.apple.com/us/review?id=324684580&reviewId=14199691787
7948c2c965da8532,Play Store,review,2026-06-19T02:44:39+00:00,4,4★ review,Great music and sound... This would be my all time favorite music app They have albums ready for any mood you want Update artist albums with all there music together in one place🙏,Ngozi Amadi,https://play.google.com/store/apps/details?id=com.spotify.music&reviewId=bbda0811-df06-4a94-9133-ecfe8b884389
9c1db3eaddfc4fbc,Play Store,review,2026-06-19T02:21:43+00:00,1,1★ review,"App has not stopped crashing since the last update. Now I can't even get songs to play for 2 seconds before the app completely crashes and I get a notification saying the app has a bug and to update when a fix is provided. I pay for premium and I can't access my playlists on mobile without the app crashing, which means I can't even access the playlists I've downloaded for offline listening. I've already cleared the cache, as instructed, but it made it worse. So frustrating.",Emily Meyer,https://play.google.com/store/apps/details?id=com.spotify.music&reviewId=26842d65-7de0-4ece-ab31-75988f7cdd8e
9b63f306c0c78692,App Store,review,2026-06-19T02:20:57+00:00,3,What’s going on,Ever time I want to search up a song it says there’s nothing I JUST WANT TO LISTEN TO A NEW SONG and plus the app is extremely laggy now ands I don’t know what’s happening,I make rewiews guy,https://itunes.apple.com/us/review?id=324684580&reviewId=14199629723
cb58ef7f622b4eed,Play Store,review,2026-06-19T02:13:38+00:00,3,3★ review,"It's been a good app, but I feel like ""smart shuffle"" shouldn't be playing the same songs. It's starting to become like Pandora.",Stephen Kazy,https://play.google.com/store/apps/details?id=com.spotify.music&reviewId=f8eb8c1f-a8d6-4ebc-aa34-7c2a54976839
a95a16bb2e01fb4e,App Store,review,2026-06-19T01:56:47+00:00,4,It’s great,"I love Spotify, it’s usually my go to music app. I can’t afford Premium, so I’ve always stuck with the free version, and honestly I was fine with that. But lately it’s been driving me crazy. I’ll play one of my playlists, and after one or two songs it switches to recommended tracks. When I try to go back to my playlist, it won’t let me and just keeps reminding me to buy Premium if I want to listen to what I actually picked. Anyways I still do think highly of the app and would like to recommend to others but at the moment I hesitate to",Anonymous_4 now,https://itunes.apple.com/us/review?id=324684580&reviewId=14199566821
f861a04f4035c4c8,App Store,review,2026-06-19T01:55:11+00:00,5,Diversity,The shuffle play has been elite since day UNO. No shade at l🍎 music. Spotify is superior,Thatguyy4,https://itunes.apple.com/us/review?id=324684580&reviewId=14199562524
3695f6c0a4a02da7,Play Store,review,2026-06-19T01:43:19+00:00,1,1★ review,"Title: This app has become terrible! Review: Spotify used to be great, but now it is completely ruined. There are way too many annoying ads. Whenever I search for a specific song, it forces me to listen to a whole playlist instead of that song. On top of that, you can only skip 6 songs in 2 hours! It is incredibly frustrating just trying to listen to one single song. This app seriously needs an urgent update and major improvements, otherwise, it is completely useless. Fix this or close it down!",Siya 611,https://play.google.com/store/apps/details?id=com.spotify.music&reviewId=47ad9199-6f52-450f-9205-f2f9628866a0
8e1ae49514f4ebe7,Play Store,review,2026-06-19T01:32:34+00:00,2,2★ review,ADDS ON A PAID SUBSCRIPTION?!?!?! COULD NOT SKIP?!?!?! ONE MORE TOME AND NO MORE MONEY FOR YOU!!! Other wise I like it a lot.,Eric Elsberry,https://play.google.com/store/apps/details?id=com.spotify.music&reviewId=cca16c7f-be7c-4a40-96ff-055a2fd30171
bc6b003bf96479e2,App Store,review,2026-06-19T01:26:46+00:00,5,Awesome sauce,"I pick my music , huge selection so manny options and choices. I create playlists I want. This is exactly what I want. Can’t go wrong with Spotify. Your music your selections",SanfordP,https://itunes.apple.com/us/review?id=324684580&reviewId=14199488169
d2ab90b9083a2b84,Play Store,review,2026-06-19T01:25:21+00:00,1,1★ review,Why can't they fix the bug that keeps pausing playlist plays randomly? For months. Despite updates.,Kristo Vaher,https://play.google.com/store/apps/details?id=com.spotify.music&reviewId=f8d2217d-4b36-4889-a087-7eee07779b50
eee3c0c555dafaf5,App Store,review,2026-06-19T01:18:07+00:00,4,Could’ve been a 5,Shuffle repeats the same songs,MY000009,https://itunes.apple.com/us/review?id=324684580&reviewId=14199465276
08cc02c37eaffcb3,Play Store,review,2026-06-19T01:11:39+00:00,5,5★ review,This is an amazing experience that I am in love with because of good music and recommendations!!,Vicente De Leon,https://play.google.com/store/apps/details?id=com.spotify.music&reviewId=b6e10639-3740-4d7d-9c43-422aff7de452
d41d0bd42cda161e,App Store,review,2026-06-19T01:08:36+00:00,5,Love the Algorithm!,I absolutely love how Spotify can pick up on what’s songs you like or would like after you play your whole playlist. That’s how I discover new music and artist! Apple Music can’t even compare!,WhitneyOnTheLash,https://itunes.apple.com/us/review?id=324684580&reviewId=14199440621
2d8bece5c1744df6,App Store,review,2026-06-19T00:51:33+00:00,1,Playlist,The songs are overlapping when im on shuffle?,indykiwi,https://itunes.apple.com/us/review?id=324684580&reviewId=14199395823
f78270f1d047ddae,App Store,review,2026-06-19T00:43:42+00:00,2,So glitchy recently,I’ve been using Spotify for around ten years now but recently it’s been so glitchy and annoyingly slow :( also pleasseee make it an option to make all of your liked songs in a one playlist easier instead of adding one song at a time 🙏🙏🙏,Billianak,https://itunes.apple.com/us/review?id=324684580&reviewId=14199375271
957da6dc6af3eb45,App Store,review,2026-06-19T00:40:08+00:00,4,OPM,"please add a quick filter on my ""liked songs"" playlist for ""OPM"" (Original Pilipino Music) please add OPM filter please please please please",nimurumi,https://itunes.apple.com/us/review?id=324684580&reviewId=14199365905
521cf6302820c45d,Play Store,review,2026-06-19T00:04:17+00:00,3,3★ review,"at this point, I might as well use yt music because a lot of the stuff that I feel like should be part of the free version isn't like, we only get six skips per hour.And I agree, we hardly even get like any options of our own playlist, like we make the playlist.We don't want other people barging in on our own playlist. i really hope that eventually it gets better.Because it's really frustrating right now sometimes.",Emma Wiens,https://play.google.com/store/apps/details?id=com.spotify.music&reviewId=0a423a99-8910-4ddb-9432-997c370424ec
938ed56094e014a7,Play Store,review,2026-06-19T00:03:38+00:00,1,1★ review,"Horrible app. Very buggy, both mobile and desktop. It is laughably badly developed, even though spotify's only product is the software... It is almost insulting. I've used it on powerful PCs and had same issues. There are too many issues to name; the most prelevant ones are: extremely slow and buggy UI, horrible cache management (went to 50gb+ very quick), randomly switching to other device, etc etc. Even the shuffle was broken for many years... A 13 year old could code a better app...",First name Surname,https://play.google.com/store/apps/details?id=com.spotify.music&reviewId=05cf46e7-bce1-41f8-b541-a1e8920d957f
1886d1d79f4cc94c,Play Store,review,2026-06-18T23:58:11+00:00,1,1★ review,Full ads after 1 song... highly not recommended,mani kumar mani,https://play.google.com/store/apps/details?id=com.spotify.music&reviewId=1084de6c-89af-4098-9a0d-8df235c604b7
5a4241c1b3e9742c,Play Store,review,2026-06-18T23:50:17+00:00,2,2★ review,"Spotify needs to really calm down a notch, 3 ads then i could listen to one song, i skip the song but i have to listen to 4 ads now, believe me every time this happens I'm closing the app and switching to SoundCloud, this is a joke",Qais Salloum,https://play.google.com/store/apps/details?id=com.spotify.music&reviewId=6983372a-df90-4517-85fa-6f4103048b0b
