id,source,type,date,rating,title,text,author,url
2bd7107ee90e6aab,Reddit,comment,2025-05-19T02:57:46+00:00,,Reddit comment,"This subreddit is mainly for sharing playlists. This is not a Spotify support forum. Complaints, technical/support questions, and “does anybody else” questions are discouraged and may be removed. They should be directed to the pinned mega thread. Consider r/truespotify for questions or contact Spotify directly. This sub is not for advertisement or promotional purposes whether for playlist follows/likes, bands/artists, or profiles followers/boosts.",spotify-ModTeam,https://www.reddit.com/r/spotify/comments/1kq1hie/anyone_know_the_email_or_way_to_report_bugs/mt28h0i/
30b88c8601ebd16e,Reddit,discussion,2025-05-19T02:57:28+00:00,,Anyone know the email or way to report bugs?,"Hello! I am a premium user, (if that is relevant in this case) and I went to use the Spotify AI playlist creator. When I asked it to create a playlist full of songs that have never been recommended to me/ new creators who I may not of heard before, I kept getting an error message. I was wondering if anyone knew the email I could use to let Spotify know that this is happening? Thanks.",Lemondall,https://www.reddit.com/r/spotify/comments/1kq1hie/anyone_know_the_email_or_way_to_report_bugs/
502f7815975cfaed,Reddit,comment,2025-05-19T02:57:13+00:00,,Reddit comment,"No offense, just thought I'd share my playlist of great Progg with you.... https://open.spotify.com/playlist/7AkSgRhaWTNbankZ9aPYdu?si=K9BYL25bSsSomcV4nK4ulA It has almost 8200 tunes, almost 800 hours of great Progg. Lots of variety/crossover. Rock on! Klh",ProgRock1956,https://www.reddit.com/r/spotify/comments/1kpzxi7/help_me_with_find_some_playlists_for_new_music/mt28e4v/
1e2be388ccbd5eb9,Reddit,comment,2025-05-19T02:55:44+00:00,,Reddit comment,Any party by feist How can you be sure by Radiohead Sweet Jane by the velvet underground Trouble by cage the elephant,Nevaehinthea1ps,https://www.reddit.com/r/spotify/comments/1kpxa6p/which_songs_feel_like_youre_in_a_movie/mt286f2/
a80d725f3c91a8c1,Reddit,comment,2025-05-19T02:50:24+00:00,,Reddit comment,"This subreddit is mainly for sharing playlists. This is not a Spotify support forum. Complaints, technical/support questions, and “does anybody else” questions are discouraged and may be removed. They should be directed to the pinned mega thread. Consider r/truespotify for questions or contact Spotify directly. This sub is not for advertisement or promotional purposes whether for playlist follows/likes, bands/artists, or profiles followers/boosts.",spotify-ModTeam,https://www.reddit.com/r/spotify/comments/1kq1ctb/i_think_i_might_have_been_hacked/mt27eq2/
28319ab373a8b6d9,Reddit,discussion,2025-05-19T02:47:52+00:00,,How do I get good?,"Hey guys. I am trying to get good at piano. I have been playing it for a couple years now, and am pretty good, but honestly, I kinda struggle with improvisation. Like, I feel like I lack some of the music theory knowledge to effectively make a song. I don’t know what chords to use, and I don’t know a lot of the chord names and shapes without looking at a diagram. Do y’all have any suggestions and resources that could help me?",void5647,https://www.reddit.com/r/Music/comments/1kq1bay/how_do_i_get_good/
82cf069fa7ab00e4,Reddit,comment,2025-05-19T02:46:41+00:00,,Reddit comment,i wouldn't be surprised if the last couple years of wrapped used ai,msr_aye,https://www.reddit.com/r/truespotify/comments/1kpzqm9/when_spotify_wrapped_says_i_listened_to_3_artists/mt26v14/
2a7076008077a7be,Reddit,comment,2025-05-19T02:43:42+00:00,,Reddit comment,"This subreddit is mainly for sharing playlists. This is not a Spotify support forum. Complaints, technical/support questions, and “does anybody else” questions are discouraged and may be removed. They should be directed to the pinned mega thread. Consider r/truespotify for questions or contact Spotify directly. This sub is not for advertisement or promotional purposes whether for playlist follows/likes, bands/artists, or profiles followers/boosts.",spotify-ModTeam,https://www.reddit.com/r/spotify/comments/1kq02oa/bro_rremove_the_new_playlist_update/mt26f8x/
ffead5207f51136a,Reddit,comment,2025-05-19T02:43:23+00:00,,Reddit comment,"This subreddit is mainly for sharing playlists. This is not a Spotify support forum. Complaints, technical/support questions, and “does anybody else” questions are discouraged and may be removed. They should be directed to the pinned mega thread. Consider r/truespotify for questions or contact Spotify directly. This sub is not for advertisement or promotional purposes whether for playlist follows/likes, bands/artists, or profiles followers/boosts.",spotify-ModTeam,https://www.reddit.com/r/spotify/comments/1kpzypl/spotify_needs_to_let_us_make_our_liked_songs/mt26dj0/
9c8ebc419f99bc39,Reddit,comment,2025-05-19T02:33:07+00:00,,Reddit comment,My liked songs playlists are just a mix of songs that don’t fit into any other playlists so would be great if I had the option to make it public,EvadingPermBan,https://www.reddit.com/r/spotify/comments/1kpzypl/spotify_needs_to_let_us_make_our_liked_songs/mt24ue1/
1560255383105d26,Reddit,discussion,2025-05-19T02:27:16+00:00,,Spotify premium ios,Is there any way to download spotify premium free on ios and still has the same features as the paid one like spotify wrapped And also pls drop a tutorial ! Thank you,itsmehi1349,https://www.reddit.com/r/sideloaded/comments/1kq0xua/spotify_premium_ios/
2aae0dda90c7b13f,Reddit,comment,2025-05-19T02:21:37+00:00,,Reddit comment,"No prob, lmk if you enjoy anything in particular. I'm familiar with the output of most bands in there.",stringhead,https://www.reddit.com/r/spotify/comments/1kpzxi7/help_me_with_find_some_playlists_for_new_music/mt2327w/
2f1db6b3c3e2b6cf,Reddit,discussion,2025-05-19T02:21:35+00:00,,New Artist jus sign to Dr dre,[removed],Cramer1M,https://www.reddit.com/r/Music/comments/1kq0u4n/new_artist_jus_sign_to_dr_dre/
0d86306c69cb8eec,Reddit,comment,2025-05-19T02:18:06+00:00,,Reddit comment,Unfortunately it seems that the only working method right now is to manually upload the local files to your phone. A real pain when you have a giant local library and only want certain playlists in spotify to download the local songs they might contain.,Tite_Reddit_Name,https://www.reddit.com/r/truespotify/comments/1i6sfe1/spotify_sync_local_files_possible/mt22hsn/
81e963ab6b214244,Reddit,comment,2025-05-19T02:12:42+00:00,,Reddit comment,"You can create each genre you have as a playlist then combine them into one (ik its mote effort, but eh ill take the compromise)",Abject-Particular968,https://www.reddit.com/r/spotify/comments/1kpzypl/spotify_needs_to_let_us_make_our_liked_songs/mt21mbi/
dc56039284306391,Reddit,discussion,2025-05-19T02:11:03+00:00,,Graduation music,"I am putting together one of them cheesy graduation PowerPoints for my daughter. Always told myself I wouldn't be one of those dads, but here I am... And I love it. So I would love some ideas and recommendations for songs I should include. I'm also going to need one next year for my son, so would really like some father (or mother)/son songs, since those seem even harder to find Thank you all in advance!",HumanFrijole,https://www.reddit.com/r/Music/comments/1kq0mrj/graduation_music/
4dfbb3933ae90d57,Reddit,comment,2025-05-19T02:09:20+00:00,,Reddit comment,pls use shuffle,TopBid7531,https://www.reddit.com/r/spotify/comments/1kpzxi7/help_me_with_find_some_playlists_for_new_music/mt212nb/
97dcb7a29a40a80f,Reddit,comment,2025-05-19T02:09:19+00:00,,Reddit comment,"[Jorge Elbrecht.](https://open.spotify.com/playlist/13jq2cgQEVU526onway585?) [Laid In Stone/Segue 2](https://open.spotify.com/playlist/4ipTUrcwoOpeQV054BXDnR?) If anything on these strikes a chord and you want more, let me know.",SideStreetHypnosis,https://www.reddit.com/r/spotify/comments/1kpqt9f/indie_vibes_playlistsong_recommendations/mt212hp/
05e1186509f0c7df,Reddit,discussion,2025-05-19T02:09:19+00:00,,Spotify login question: AppleTV pulled up a Spotify account we didn’t recognize,"My boyfriend and I stayed at a hotel over the weekend, and the TV didn’t offer any app streaming services of the sort. What it did offer, however, was an HDMI port for us to hook up our Apple TV. We hooked it up and signed into Spotify by using our personal device(phone). The single sign-on sent a verification code to our phones, we plugged the code into Spotify on our AppleTV, and the night went on. It logged us out the next day, and in its place was a logged in account of a girl’s name I don’t recognize. What is the plausibility that this is just some weird mix up? What with the needed code to enter into AppleTV it’s hard to believe my boyfriend’s playing dumb about it but also we were in a hotel and my first thought was that it was crossover from another tenant. But what even would’ve been the mechanics of that?",dillp1ckle,https://www.reddit.com/r/NoStupidQuestions/comments/1kq0lhx/spotify_login_question_appletv_pulled_up_a/
089e618d68ed9528,Reddit,comment,2025-05-19T02:09:03+00:00,,Reddit comment,Dude so do you! And soo many playlists too! Followed you 🛐,gojospinkyfinger,https://www.reddit.com/r/spotify/comments/1kmtmjk/spotify_mutuals/mt210xu/
d1c759b879cca062,Reddit,comment,2025-05-19T02:08:37+00:00,,Reddit comment,This is my life-blood. Endless jams from multiple genres. It could scratch your itch https://open.spotify.com/playlist/6iRpBobGpYcVobsFconsq7?si=VW_POa1-SsWDZRBdlJa4jg,TimmyO_1138,https://www.reddit.com/r/spotify/comments/1kpzxi7/help_me_with_find_some_playlists_for_new_music/mt20yet/
b216054ee1e525dc,Reddit,comment,2025-05-19T02:08:17+00:00,,Reddit comment,"this has everything from slam metal to japanese pop. Synth, rock, punk, goth, metal, vkei, black metal, dsbm, experimental, classical music, shoegaze, alt rock, shibuya-kei, industrial, j-rock, k-metal, k-goth, j-goth and so much more. https://open.spotify.com/playlist/6UfsOns7cqdGSwIsyGfaM0?si=IAa6hpLWTsGH_UtalCBewg&pi=SuZk-MQPScuTl",TopBid7531,https://www.reddit.com/r/spotify/comments/1kpzxi7/help_me_with_find_some_playlists_for_new_music/mt20wfo/
99d1220f20a965a8,Reddit,discussion,2025-05-19T02:00:46+00:00,,How to access playlist with downloaded songs on my phone?,"Whenever I download songs from my computer and add them to a playlist, I can see the playlist and all the downloaded songs on my iphone, but they won't download, thus not letting me play them on my phone. Sometimes it works, most of the time it doesn't, please help!",InevitableLie493,https://www.reddit.com/r/truespotify/comments/1kq0fon/how_to_access_playlist_with_downloaded_songs_on/
3a00e08e6426485c,Reddit,discussion,2025-05-19T01:40:47+00:00,,bro rremove the new playlist update,ITS SO FRICKING ANNOYING IT DIDNT EVEN UPDATE ALL THE OLDER PLAYLISTS SO IT JUST LOOKS STUPID,yourcannibal,https://www.reddit.com/r/spotify/comments/1kq02oa/bro_rremove_the_new_playlist_update/
859ea2b2e42973c3,Reddit,discussion,2025-05-19T01:37:47+00:00,,Doppler app is the best way to listen to your own bought/downloaded music without relying on Spotify or Apple truly amazing app i already have over 3k songs on it,"I don't work for them or anything but just wanted to put yall on for people that are tired of having to rely on subscriptions to enjoy music, with this app you can use it offline and add as many songs to it especially good for live performances or mixtapes that aren't on streaming platforms, you can export directly from your mac to the app thats on your phone also. there's one lifetime fee of like 15$ if i remember right and that's it",Upset_Set8818,https://www.reddit.com/r/ios/comments/1kq00m2/doppler_app_is_the_best_way_to_listen_to_your_own/
96c6c45f48141e09,Reddit,discussion,2025-05-19T01:34:57+00:00,,Spotify needs to let us make our liked songs playlist public.,Upvote if you agree,EvadingPermBan,https://www.reddit.com/r/spotify/comments/1kpzypl/spotify_needs_to_let_us_make_our_liked_songs/
fe5024d2892d7d58,Reddit,discussion,2025-05-19T01:34:33+00:00,,Doppler app is the best way to listen to your own bought/downloaded music without relying on Spotify or Apple truly amazing app i already have over 3k songs on it,"I don’t work for them or anything but just wanted to put yall on for people that are tired of having to rely on subscriptions to enjoy music, with this app you can use it offline and add as many songs to it especially good for live performances or mixtapes that aren’t on streaming platforms, you can export directly from your mac to the app thats on your phone also. there’s one lifetime fee of like 15$ if i remember right and that’s it",JustCranberry1384,https://www.reddit.com/r/ios/comments/1kpzyfp/doppler_app_is_the_best_way_to_listen_to_your_own/
a9d915a42064c836,Reddit,discussion,2025-05-19T01:33:06+00:00,,Help me with find some playlists for new music.,"Looking for new music the below list some of my all time favourites. Don’t want playlists featuring these artists but gives you an idea of the styles. Sonic Youth, The Fall, Joydivision, The Cure. Ride, My bloody valentine. Cheap Trick, Big Star, David Bowie. Kraftwerk, Early Tangerine Dream, Faust. Chemical Brothers, The Prodigy, Gesaffelstein, Forest Sword. Thundercat, Frank Zappa, Rush, King Crimson. Hendrix, Credence. Ulver, Darkthrone, Earth. Willie Nelson, electric Dylan.",Billyjamesjeff,https://www.reddit.com/r/spotify/comments/1kpzxi7/help_me_with_find_some_playlists_for_new_music/
ed3b20c592bd1d7c,Reddit,discussion,2025-05-19T01:32:47+00:00,,Spotify needs to let us make our liked songs playlist 💜public.,[removed],EvadingPermBan,https://www.reddit.com/r/spotify/comments/1kpzxak/spotify_needs_to_let_us_make_our_liked_songs/
6bf1e7943167f90f,Reddit,comment,2025-05-19T01:26:35+00:00,,Reddit comment,I miss the old wrapped. I remember it being better than what we got most recently,wayathrow001818454,https://www.reddit.com/r/truespotify/comments/1kpzqm9/when_spotify_wrapped_says_i_listened_to_3_artists/mt1u8g8/
7b697cb9cf8f5a5a,Reddit,discussion,2025-05-19T01:22:36+00:00,,When Spotify Wrapped says I listened to 3 artists like Im some kind of musical minimalist,"I didn’t endure 7-hour playlists called “emotional damage arc” just to get told my top genre was “pop.” Spotify, I’m not a casual - I’m in a committed situationship with obscure subgenres. Normies wouldn’t understand. Press F if your Wrapped gaslit you too.",battfopa,https://www.reddit.com/r/truespotify/comments/1kpzqm9/when_spotify_wrapped_says_i_listened_to_3_artists/
8a9e8ac737842f59,Reddit,discussion,2025-05-19T00:59:31+00:00,,El Gato Capture Card audio source,Hey there! i’m running into a problem with my capture card in OBS windows and cannot find help ANYWHERE on the internet my problem is this - my el gato capture card audio is running to my audio mixer twice. Once through the app source i have set up directly from the capture card and secondly to my desktop audio. I need to get it to NOT be included in the desktop audio source. I have my desktop audio - pulling my twitch & sound alerts. but right now it is also pulling my Spotify app and my capture card audio. And I have no idea how to separate it from that I would like to have full control of the individual apps outside of the desktop audio because they obviously all cannot be the same while I am streaming. I am at a loss! Bonus points if you can help with the spotify app as well cuz it is doing the same thing. Thnx,wubwub123_,https://www.reddit.com/r/obs/comments/1kpzau2/el_gato_capture_card_audio_source/
b65a04803c349702,Reddit,discussion,2025-05-19T00:57:25+00:00,,Stephen Port aka “The Grindr Killer”,"**Listen To The Full Story Here:** [bio.site/beerswithqueers](https://bio.site/beerswithqueers) He seemed ordinary. Awkward. Forgettable, even. But behind Stephen Port’s soft voice and boyish face was one of the UK’s most manipulative serial killers—one who used the very apps meant to connect LGBTQ+ people as tools for murder. Between 2014 and 2015, four young men were found dead within yards of his East London flat. They’d all been drugged. They’d all met him through Grindr. And they’d all been discarded like trash after their deaths. In this gripping episode, we walk you through how Port gained the trust of his victims through charm and lies—then lured them to his apartment for drug-fueled encounters that ended in fatal overdoses of GHB. Port staged their bodies to appear as suicides, even placing fake notes in the pockets of his victims. But the truth was far more horrifying—and the clues were hiding in plain sight. What makes this case even more chilling is the way authorities handled it. Despite clear patterns, physical evidence, and pleas from the victims' families, London’s Metropolitan Police repeatedly dismissed the deaths as accidental, overlooking key links and ignoring mounting concerns from the queer community. The case exposed systemic failures in how police treat LGBTQ+ victims—and how bias can be deadly. We explore the victims’ stories, the missed opportunities, and the aftermath of the investigation that finally brought Port to justice. This isn’t just the story of a serial killer—it’s a story about who gets listened to, and who doesn’t, in a system built to protect some more than others. **Beers With Queers: A True Crime Podcast 🍻🌈🔪** Welcome to Beers With Queers, the true crime podcast where we dive into the darkest, most twisted cases and involving the LGBTQ+ community and always with a queer perspective. Hosted by Jordi and Brad, we cover everything from notorious serial killers to unsolved mysteries, cults, and bizarre crimes. Join us for in-depth storytelling, chilling details, queer history and really gay commentary. So, whether you're here for the crimes, the beers, or the queers, you're in the right place. So, grab a drink, get cozy, and let’s talk true crime! 🔔 Subscribe now and never miss an episode! 🎧 Listen on Spotify, Apple Podcasts, Amazon Music, Audible or wherever you get your podcasts • [Listen AD FREE On Patreon](https://www.patreon.com/beerswithqueers?utm_medium=unknown&utm_source=join_link&utm_campaign=creatorshare_creator&utm_content=copyLink) • [Listen On Apple Podcast](https://podcasts.apple.com/us/podcast/beers-with-queers-a-true-crime-podcast/id1571643278) • [Listen On Spotify For Podcasters](https://creators.spotify.com/pod/profile/beers-with-queers/) • [Listen On Spotify](https://open.spotify.com/show/6HRsEjMxyJXPi5dlZqAPFL) • [Listen On Amazon Music](https://music.amazon.com/podcasts/84d1977f-1531-4004-a95f-12480ba093f3/beers-with-queers-a-true-crime-podcast) • [Listen On Audible](https://www.audible.com/podcast/Beers-with-Queers-A-True-Crime-Podcast/B0CT2JFGT6?ref_pageloadid=not_applicable&ref=a_es-US_pd_c1_podcast-show-details&pageLoadId=YVRP8UwEjV1mFZgP&creativeId=16015ba4-2e2d-4ae3-93c5-e937781a25cd) • [Listen On Pocket Casts](https://play.pocketcasts.com/podcasts/9db41b80-abe6-0139-c187-0acc26574db2) • [Follow Us On Instagram](https://www.instagram.com/beerswithqueerspod/) • [Follow Us On Facebook](https://www.facebook.com/profile.php?id=100088260902164) **Cheers, queers! 🍻✨** [Talk True Crime With Us On Telegram](https://t.me/BeersWithQueersPodcast) **Keywords:** Stephen Port, Grindr Killer, London serial killer, GHB murders, gay dating app danger, chemsex deaths, LGBTQ+ true crime, UK police scandal, queer victimization, gay serial killer, Stephen Port trial, Metropolitan Police failures, queer justice, Beers With Queers podcast, LGBTQ community crime, East London murders, Grindr horror story, systemic bias, LGBTQ+ advocacy, queer murder victims",ThatAverageJo,https://www.reddit.com/r/BeersWithQueers/comments/1kpz9gf/stephen_port_aka_the_grindr_killer/
0ad1c3c60e74f70d,Reddit,discussion,2025-05-19T00:54:51+00:00,,Stephen Port aka “The Grindr Killer”,"**Listen To The Full Story Here:** [bio.site/beerswithqueers](https://bio.site/beerswithqueers) He seemed ordinary. Awkward. Forgettable, even. But behind Stephen Port’s soft voice and boyish face was one of the UK’s most manipulative serial killers—one who used the very apps meant to connect LGBTQ+ people as tools for murder. Between 2014 and 2015, four young men were found dead within yards of his East London flat. They’d all been drugged. They’d all met him through Grindr. And they’d all been discarded like trash after their deaths. In this gripping episode, we walk you through how Port gained the trust of his victims through charm and lies—then lured them to his apartment for drug-fueled encounters that ended in fatal overdoses of GHB. Port staged their bodies to appear as suicides, even placing fake notes in the pockets of his victims. But the truth was far more horrifying—and the clues were hiding in plain sight. What makes this case even more chilling is the way authorities handled it. Despite clear patterns, physical evidence, and pleas from the victims' families, London’s Metropolitan Police repeatedly dismissed the deaths as accidental, overlooking key links and ignoring mounting concerns from the queer community. The case exposed systemic failures in how police treat LGBTQ+ victims—and how bias can be deadly. We explore the victims’ stories, the missed opportunities, and the aftermath of the investigation that finally brought Port to justice. This isn’t just the story of a serial killer—it’s a story about who gets listened to, and who doesn’t, in a system built to protect some more than others. **Beers With Queers: A True Crime Podcast 🍻🌈🔪** Welcome to Beers With Queers, the true crime podcast where we dive into the darkest, most twisted cases and involving the LGBTQ+ community and always with a queer perspective. Hosted by Jordi and Brad, we cover everything from notorious serial killers to unsolved mysteries, cults, and bizarre crimes. Join us for in-depth storytelling, chilling details, queer history and really gay commentary. So, whether you're here for the crimes, the beers, or the queers, you're in the right place. So, grab a drink, get cozy, and let’s talk true crime! 🔔 Subscribe now and never miss an episode! 🎧 Listen on Spotify, Apple Podcasts, Amazon Music, Audible or wherever you get your podcasts • [Listen AD FREE On Patreon](https://www.patreon.com/beerswithqueers?utm_medium=unknown&utm_source=join_link&utm_campaign=creatorshare_creator&utm_content=copyLink) • [Listen On Apple Podcast](https://podcasts.apple.com/us/podcast/beers-with-queers-a-true-crime-podcast/id1571643278) • [Listen On Spotify For Podcasters](https://creators.spotify.com/pod/profile/beers-with-queers/) • [Listen On Spotify](https://open.spotify.com/show/6HRsEjMxyJXPi5dlZqAPFL) • [Listen On Amazon Music](https://music.amazon.com/podcasts/84d1977f-1531-4004-a95f-12480ba093f3/beers-with-queers-a-true-crime-podcast) • [Listen On Audible](https://www.audible.com/podcast/Beers-with-Queers-A-True-Crime-Podcast/B0CT2JFGT6?ref_pageloadid=not_applicable&ref=a_es-US_pd_c1_podcast-show-details&pageLoadId=YVRP8UwEjV1mFZgP&creativeId=16015ba4-2e2d-4ae3-93c5-e937781a25cd) • [Listen On Pocket Casts](https://play.pocketcasts.com/podcasts/9db41b80-abe6-0139-c187-0acc26574db2) • [Follow Us On Instagram](https://www.instagram.com/beerswithqueerspod/) • [Follow Us On Facebook](https://www.facebook.com/profile.php?id=100088260902164) **Cheers, queers! 🍻✨** [Talk True Crime With Us On Telegram](https://t.me/BeersWithQueersPodcast) **Keywords:** Stephen Port, Grindr Killer, London serial killer, GHB murders, gay dating app danger, chemsex deaths, LGBTQ+ true crime, UK police scandal, queer victimization, gay serial killer, Stephen Port trial, Metropolitan Police failures, queer justice, Beers With Queers podcast, LGBTQ community crime, East London murders, Grindr horror story, systemic bias, LGBTQ+ advocacy, queer murder victims",ThatAverageJo,https://www.reddit.com/r/BeersWithQueers/comments/1kpz7u6/stephen_port_aka_the_grindr_killer/
cb11f11cb562a6ab,Reddit,comment,2025-05-19T00:54:12+00:00,,Reddit comment,"Nah, i don’t think it is fair, but i recommend r/audible",David79YT,https://www.reddit.com/r/truespotify/comments/1kphcc6/do_you_think_spotifys_15hour_monthly_limit_on/mt1p0yg/
