id,source,type,date,rating,title,text,author,url
e11007da7a957323,Reddit,discussion,2025-05-18T04:56:00+00:00,,"Help please, Spotify ghost harassing me...","I need help... 3 months ago, my Spotify account has started playing songs, randomly, that I did not request or start listening to. The phone will be on the counter and randomly it'll be playing a Spotify song... but it's a song I don't know and not on my Playlist. I didn't turn it on or open Spotify. I tried log out everywhere and changed my password. I also removed any integrations just incase. It keeps doing it though. 2am, 4pm, 11am, random, and always the same weird 2 or 3 songs that I don't know and arnt in my playlist. It's been months and no resolution. My next plan is to just close the account entirely, but I dont see a way to move my playlist with 800 songs to the new account AND still let me add more to it. I can see a way to make it public and then share that public playlist with the new account but that new account will not be able to add more songs to that same playlist. Is there a way to move the playlist to a new account in a way that the new account can add songs to that same playlist. I don't want to share the playlist with the new account I want to transfer it fully so that the new account can add songs and continue to grow that playlist. Can this be done? I feel it is my only option at this point... please help me escape this Spotify ghost that is haunting me...",reicaden,https://www.reddit.com/r/truespotify/comments/1kpc3af/help_please_spotify_ghost_harassing_me/
39f91161fc9e755b,Reddit,discussion,2025-05-18T04:51:21+00:00,,"Discover a unique AI companion for mindfulness, learning, and positive vibes","Hey everyone, I'm excited to share an app I've been working on called **Hindu Hub: Chat, Mantra, Gita**. While the name references Hindu traditions, my goal was to create a tool that can be a source of peace, learning, and positive engagement for anyone interested in these areas, regardless of their background. Think of it as a digital space where you can: * **Engage in insightful conversations:** The AI is designed to chat on topics related to mindfulness, positive thinking, and timeless wisdom found in ancient texts. * **Explore calming practices:** There's a feature for guided mantra chanting with a virtual mala, which can be a great way to focus and de-stress. * **Learn and explore:** Dive into the teachings of the Bhagavad Gita in an accessible way, or explore stories and concepts from Hindu mythology for their universal lessons. I've focused on creating a clean, user-friendly interface and a respectful approach to the content. It's still evolving, and I'm really keen to hear what the Android community thinks. [https://play.google.com/store/apps/details?id=com.naiveminds.spiritual\_ai\_chat&hl=en&utm\_source=reddit\_aa](https://play.google.com/store/apps/details?id=com.naiveminds.spiritual_ai_chat&hl=en&utm_source=reddit_aa)",Critical-Ad-7004,https://www.reddit.com/r/androidapps/comments/1kpc0r4/discover_a_unique_ai_companion_for_mindfulness/
081210ed1343b6b8,Reddit,discussion,2025-05-18T04:03:40+00:00,,why do people say youtube music have way better algorithm than spotify?,"I subscribed to both of youtube premium and spotify. I used youtube music many times but I think spotify has introduced me more niche artists. for example, curated playlists called ""alternative hip hop"" and ""anti pop"". daylist is good too. song radio gave me way more niche artists when I played underground rappers like Black Soprano Family compared to youtube music. youtube music has underground hip hop playlist too but spotify has more obscure rappers names. but when I google ""youtube music vs spotify"" I found people saying youtube music has way better algorithm. what do you think? thanks.",Aromatic_Memory1079,https://www.reddit.com/r/truespotify/comments/1kpb9et/why_do_people_say_youtube_music_have_way_better/
e652e5ac9aca6d10,Reddit,discussion,2025-05-18T02:21:29+00:00,,"I'll try my best to explain my prob, but no guarantees lol","Ok, so I have had this problem on my IPhone 13 for a little bit. When I open the app store, it brings me to the search page. No prob, I search up the app I want to download. Instead of letting me search tho, I can only type a few letters before It brings me to the homepage of the app store. After that, I can click on the search button again and retype but its pretty annoying that I have to retype it. I've thought that its the app store warming up or smth so I will wait a bit before typing, but then it still brings me back to the homepage.",ArianaFraggle1997,https://www.reddit.com/r/ios/comments/1kp9hsi/ill_try_my_best_to_explain_my_prob_but_no/
a7ba53230ee6591a,Reddit,discussion,2025-05-18T02:00:00+00:00,,Metal/Rock playlist,"https://open.spotify.com/playlist/3ogCgypYyecWPwQWFx06oh?si=Sx62MVZsTU2Q1ZuPwWJUkg&pi=mBKoxt3OTbGpu Take a look, any more recomendations?",Snoo_8775,https://www.reddit.com/r/spotify/comments/1kp93za/metalrock_playlist/
8845e00504f0e028,Reddit,discussion,2025-05-18T01:59:23+00:00,,Why do certain songs get replaced by covers after release?,I am mostly talking about songs which have been unofficially reuploaded here. It is really annoying when I save a song to a playlist only for it to get replaced by a cover by some random guy a month or so later. Either that or the vocals get deleted and it’s just the instrumental. Does anyone know why this happens? I’m guessing it’s to avoid the song being deleted?,4alpine,https://www.reddit.com/r/spotify/comments/1kp93l3/why_do_certain_songs_get_replaced_by_covers_after/
f6f4c5d417e67dfd,Reddit,discussion,2025-05-18T01:43:46+00:00,,Announcing the iOS 6 Icon Pack,"Announcing the iOS 6 Icon Pack. www.ios6iconpack.wordpress.com I am not self-promoting anything, just sharing some photos. If there are any problems or suggestions, please let me know!",Weird_Decision7090,https://www.reddit.com/r/ios/comments/1kp8tk6/announcing_the_ios_6_icon_pack/
1b91e195c206c4e2,Reddit,discussion,2025-05-18T01:03:43+00:00,,Technical question,I did some new playlists and set them as public but they don’t appear on my user profile or search. Does anyone know what it might be the issue? Thx,PreviousRoad1402,https://www.reddit.com/r/spotify/comments/1kp83ke/technical_question/
a36addbc1f8854f9,Reddit,discussion,2025-05-18T00:55:24+00:00,,depression as a playlist (none of them are on spotify) :(,depression as a playlist (none of them are on spotify) :(,Cautious_Author_326,https://www.reddit.com/r/spotify/comments/1kp7xv9/depression_as_a_playlist_none_of_them_are_on/
a404263df179906e,Reddit,discussion,2025-05-18T00:53:24+00:00,,Files app search is showing odd files,"When I use search, it often suggests files and folders like the ones shown in the screenshots. However, when I go in the iCloud Drive folder they are not to be found. Does anyone know where this inconsistency comes from?",bubuset92,https://www.reddit.com/r/ios/comments/1kp7whn/files_app_search_is_showing_odd_files/
ae82d13991c20986,Reddit,discussion,2025-05-18T00:51:56+00:00,,Uh idk,My spotify hasnt been working since last night and i can’t access the home page…the only way ive been able to play my music is going to my library..i deleted spotify and logged out of it…idk what to do bru..pls help ~_~,cries_in_gucci1,https://www.reddit.com/r/truespotify/comments/1kp7vjb/uh_idk/
d7fb0e58e61c3fa7,Reddit,discussion,2025-05-18T00:43:28+00:00,,"Posted in megathread, but need additional help...","Posted in megathread, but no replies... I could really use your help though, spotify power users. I need help... 3 months ago, my Spotify account has started playing songs, randomly, that I did not request or start listening to. The phone will be on the counter and randomly it'll be playing a Spotify song... but it's a song I don't know and not on my Playlist. I didn't turn it on or open Spotify. I tried log out everywhere and changed my password. I also removed any integrations just incase. It keeps doing it though. 2am, 4pm, 11am, random, and always the same weird 2 or 3 songs that I don't know and arnt in my playlist. It's been months and no resolution. My next plan is to just close the account entirely, but I dont see a way to move my playlist with 800 songs to the new account AND still let me add more to it. I can see a way to make it public and then share that public playlist with the new account but that new account will not be able to add more songs to that same playlist. Is there a way to move the playlist to a new account in a way that the new account can add songs to that same playlist. I don't want to share the playlist with the new account I want to transfer it fully so that the new account can add songs and continue to grow that playlist. Can this be done? I feel it is my only option at this point... please help me escape this Spotify ghost that is haunting me...",reicaden,https://www.reddit.com/r/spotify/comments/1kp7pux/posted_in_megathread_but_need_additional_help/
47555d9767483543,Reddit,discussion,2025-05-18T00:12:55+00:00,,Why 1 Million Streams Doesn’t Guarantee Success—And What Indie Artists Should Focus On Instead!,"Getting a million streams on Spotify sounds like the dream—but for many indie artists, streams alone don’t lead to sustainable growth. According to insights shared by indie artist and Hypeddit founder John Gold (13M+ Spotify streams), real success comes from building a deeper connection with fans. Here are five takeaways from John’s latest music marketing thread: 1. **Superfans > Casual Listeners** A fan who buys your merch or tickets is worth more than 10,000 random streams. 2. **Real Engagement Fuels Growth** Comments, shares, and active interactions go further than passive plays. 3. **Direct Support Pays Better** Just one album buyer or VIP ticket sale often earns more than thousands of streams. 4. **Own Your Audience** Streaming platforms control the traffic—emails, Discords, and communities give you long-term ownership of your fanbase. 5. **Loyal Fans Beat Viral Fame** Viral moments are short-lived. A loyal fanbase keeps your music career alive. John encourages artists to stop chasing numbers and start building meaningful connections. Tools like [**Hypeddit** ](https://hypeddit.krtra.com/t/R46zmoSwjNlF)and the [**Spotify Growth Switch**](https://hypeddit.krtra.com/t/VubPM9wDhcrK) help artists do exactly that—turning listeners into fans that actually support your music. **Ready to start?** Click here: [**Spotify Growth Switch**](https://hypeddit.krtra.com/t/VubPM9wDhcrK) What’s worked best for you: playlists, ads, or direct engagement? Share your experience below!",djjohngold,https://www.reddit.com/r/Hypeddit/comments/1kp75l0/why_1_million_streams_doesnt_guarantee_successand/
4d0d78a53c568363,Reddit,discussion,2025-05-17T23:46:04+00:00,,account take over but not?,"On 7/30/24 I canceled my Spotify subscription. On 1/22/25 I requested account deletion. On 2/6/25 I received notice my account was officially deleted. Today I received 4 login codes from Spotify in my email and right after a notice that Spotify account email was changed from my usual email to an email with my first and last name, but one that is not mine and I have to access to. I do not believe they accessed my Gmail at all. The new email similar to my email but flipped around and slightly different, also a Gmail account. I was able to revert the email back to my email and log into the account and reset the password. My original password is not in any data leaks and was also pretty secure. At first I thought my account wasn’t actually deleted and this person had just taken over. It was also on a family plan, people I don’t know. The address on the account is in a state I don’t live in across the country. None of the names on the family plan are similar to my name. The new account profile name was a long string of gibberish. I reached out to Spotify and they were largely unhelpful, advising me to reach out to be removed from the family plan… I did this and then was added back to this family plan. I had also reset the password and signed out of everything at this point so I’m not sure how that was accomplished again. I also asked to have the account deleted but they told me to do it so I’ve done it again. The weirdest part is that the account has playlists going back to 2022 that aren’t mine and i definitely would have noticed before I stopped using Spotify. I feel bad deleting this account but they were using my email somehow and it’s freaked me out. So what do we think happened?",PastryCop,https://www.reddit.com/r/spotify/comments/1kp6mmz/account_take_over_but_not/
8f282ca3231e91c7,Reddit,discussion,2025-05-17T23:44:06+00:00,,Drop your must have song in any playlist?,Drop your must have song in any playlist?,Realistic-Log4047,https://www.reddit.com/r/spotify/comments/1kp6l56/drop_your_must_have_song_in_any_playlist/
6d3a04dcdcf7f0ad,Reddit,discussion,2025-05-17T23:43:14+00:00,,Video player audio playback broken.,"[Informal post] I use the stock iOS video player interface a lot. And I’m absolutely infuriated by this new bug since 18.4. So while watching the audio just cuts off and you need to pause or skip to restore it. It’s in iOS as all devices do it. Absolutely horrendous, not hardware related. These things make me so angry that I’ve already smashed the hell out of iPhones multiple times because they just don’t do what’s the easiest thing for software to do! Yes I may have anger problem but this is my last iPhone. Apple knows these bugs and ACKNOWLEDGED it when I contacted them 2 months ago with evidence. They do not care. Apple was the benchmark for quality. Now it “appears” to be AI coding level standards.",Working_Attorney1196,https://www.reddit.com/r/ios/comments/1kp6kit/video_player_audio_playback_broken/
9628d09e8c19a447,Reddit,discussion,2025-05-17T23:37:12+00:00,,How To Listen To Pakistani Artists?,"I genuinely do not give a fuck about anything else , art is not supposed to be reduced to politics. i used to listen to a lot of lyrical pakistani music. They're taking down albums every single day and my playlist has been cut down to bits and pieces. There's legit nothing left. I pay premium price for a reason , not for this BS to fuck my playlists up.CAN I CHANGE MY REGION TO GET BACK THE SONGS? Is there any other fix for this? Manually downloading the songs is not possible cos there are way too many of them. Im gonna ditch Spotify if this shit doesn't come back within a month or so. Jai hind!",manasonreddit,https://www.reddit.com/r/SpotifyIndia/comments/1kp6gb3/how_to_listen_to_pakistani_artists/
2fb0e781e301519d,Reddit,discussion,2025-05-17T22:54:24+00:00,,Mail app glitch?,"Can someone explain this glitch that I’ve had for awhile and don’t know how to fix? (ignore the flagged number). On the home page it shows I have 69 unread emails, and these numbers of course don’t add up to 44. Thanks!",Mbrmusic,https://www.reddit.com/r/ios/comments/1kp5lc7/mail_app_glitch/
da107fd07ca9e464,Reddit,discussion,2025-05-17T22:50:10+00:00,,"I don’t like this layout for playlists… better with the big pic and text underneath. Can I change it, please? :)","I don’t like this layout for playlists… better with the big pic and text underneath. Can I change it, please? :)",Accomplished_Case290,https://www.reddit.com/r/truespotify/comments/1kp5iay/i_dont_like_this_layout_for_playlists_better_with/
41ad92b9c675f790,Reddit,discussion,2025-05-17T22:29:32+00:00,,Unreleased Skrillex Songs Collection & How to Listen on Spotify,"Hi All. There was this post a few weeks ago with a collection of unreleased Skrillex tracks. Shout to [Radiant-Tomatillo-32](https://www.reddit.com/user/Radiant-Tomatillo-32/). [https://www.reddit.com/r/skrillex/comments/1k6n8r6/my\_collection\_of\_unreleased\_skrillex\_songs/](https://www.reddit.com/r/skrillex/comments/1k6n8r6/my_collection_of_unreleased_skrillex_songs/) It inspired me to grab a bunch of other unreleased tracks, gather them, and find a way to listen in Spotify. (I just learned you can use local files in Spotify) Download Link: [https://drive.google.com/file/d/1hvVqT-eZBTI\_61rOfD\_W7-XCRLukDJJM/view?usp=drive\_link](https://drive.google.com/file/d/1hvVqT-eZBTI_61rOfD_W7-XCRLukDJJM/view?usp=drive_link) Playlist that includes released songs and some of the unreleased ones: [https://open.spotify.com/playlist/3V5OnPuPUdwAhVXx3ZZwlD?si=PKEgQ3B1SWWaOZVjbZqzFg&pi=QMjAQnDHQOe2T](https://open.spotify.com/playlist/3V5OnPuPUdwAhVXx3ZZwlD?si=PKEgQ3B1SWWaOZVjbZqzFg&pi=QMjAQnDHQOe2T) # Notable Additions: * Bug Hunt * Slats Slats Slats * Kyoto (Virtual Riot Remix) Full song (Fan made) * Bust Dag (Full song) * Dancing on my own (Skrillex Remix) * The Devil's Den VIP (Wolfgang Gartner) * Face my fears (Skrillex & Virtual Riot Remix) * Imagination (Skrillex Remix) * Jurassic ID * Leaving * No Money (Skrillex & Marshmello Remix) (Full song) * My Name Is Skrillex * Nothing Yet * The Reason * Scary Bolly Dub * Second Sky (Virtual Riot) * Why They Hide Their Bodies Underneath My Garage * Sonar ID * Spitefire (Full song, Fan Made) * Star Wars Lasers # How to Listen in Spotify 1. Open Mobile App > Profile Picture (top left) > Settings and privacy > Apps and devices. 2. Enable the setting ""Local audio files"". 3. Download the file ""[Skrillex Music-2025.zip](https://drive.google.com/file/d/1hvVqT-eZBTI_61rOfD_W7-XCRLukDJJM/view?usp=drive_link)"" from Google Drive. 4. Extract the .zip onto your phone. 1. On Android > Open ""Files"" app > Downloads > Tap file once > Extract. 2. On iOS > Open ""Files"" app > Downloads > Tap file once > Extract. 5. Back in Spotify, under the ""Your Library"" tab you will see a ""Local Files"" folder. 6. You can then add songs to your playlists 7. Enjoy! :)",zomagoras,https://www.reddit.com/r/skrillex/comments/1kp53jv/unreleased_skrillex_songs_collection_how_to/
21187228b34950e2,Reddit,discussion,2025-05-17T22:27:45+00:00,,Help! It won't stop adding songs,I have a ambiance playlist but Spotify keeps adding other songs to it and it won't allow me to remove them (it does this with all of my play lists) I turn off auto play similar songs but it keeps adding songs and I cant find the enhanced or smart shuffle feature,ahhhhhhhh_kevin,https://www.reddit.com/r/spotify/comments/1kp5291/help_it_wont_stop_adding_songs/
33e90c92542ecc31,Reddit,discussion,2025-05-17T22:27:19+00:00,,Date Night Playlist Assistance,"Every “date night” playlist I can find is just overly sexual and I don’t need that during my at home kitchen dates. I’m looking for like, subtly suggestive in vibe not talking about doing things on the kitchen counter. As a couple examples, Stay For A While by Victor Ray and Don’t Walk Away by The Driver Era are kind of the vibe I’m going for. More dancing in the dark less talking about take your clothes off?? Idk how to describe the vibe I’m really looking for, so I guess anything that matches the examples I gave would be great 😭",Your_Local_Hobbit,https://www.reddit.com/r/spotify/comments/1kp51yt/date_night_playlist_assistance/
ff9385dc583e505c,Reddit,discussion,2025-05-17T21:51:28+00:00,,Cool Summer Vibes - Perfect playlist for relaxing at the beach and long summer days with friends (pop),Cool Summer Vibes - Perfect playlist for relaxing at the beach and long summer days with friends (pop),jmcarlos27,https://www.reddit.com/r/spotify/comments/1kp4bc6/cool_summer_vibes_perfect_playlist_for_relaxing/
abdc7c792d631ac9,Reddit,discussion,2025-05-17T21:45:46+00:00,,v3.9.0-dev.1 - Anddea,# [3.9.0-dev.1](https://github.com/anddea/revanced-patches/compare/v3.8.1-dev.1...v3.9.0-dev.1) (2025-05-17) ### Bug Fixes - **YouTube - Overlay buttons:** Whitelisted channels could not be imported or exported ([966a84b](https://github.com/anddea/revanced-patches/commit/966a84bf5b3d34800d83706e62cf73d0c095e43f)) ### Features - **Spotify:** Add `Fix third party launchers widgets` patch ([#4893](https://github.com/anddea/revanced-patches/issues/4893)) ([eb72ee6](https://github.com/anddea/revanced-patches/commit/eb72ee67de2128cd52b3817898015c1e5e8f1a50)) - **YouTube - Hide description components:** Add `Hide Ask section` setting ([b187e6f](https://github.com/anddea/revanced-patches/commit/b187e6f8712c8c3039d20fd279c8fe9a9485f125)) - **YouTube - Settings:** Add search history and result highlighting to the settings search ([d82f279](https://github.com/anddea/revanced-patches/commit/d82f279a75415405d3e0480fc71c9a42a87bd862)),Xisrr1,https://www.reddit.com/r/YTadvanced/comments/1kp46yl/v390dev1_anddea/
2c87db9cf079383a,Reddit,discussion,2025-05-17T21:17:50+00:00,,is this new a feature?,random song suggestions??? i use spotify everyday so im not sure when i missed this. also i cant find a way to remove it. it’s just pointless bc the suggestions aren’t even relevant,2ndgradebybts,https://www.reddit.com/r/truespotify/comments/1kp3l9t/is_this_new_a_feature/
7c58679431e4ce84,Reddit,discussion,2025-05-17T21:06:59+00:00,,Galaxy A55 or Redmi Note 14 pro?,"Hello everyone, I am looking for a phone under 100k. I know the price of A55 is slight higher than 100k (its around 120k) but I thought ke phone khareed hi rahe hein tou 20k extra dey kar sahi waala khareedein. I don't do much gaming, maybe occasional subway surfers or something similar, my largest battery consumption would be Whatsapp and Spotify. I don't do much photography either (especially selfies) lekin kabhi occasional pictures lene ka mood ho tou quality decent honi chaiye. My main reason to go for A55 is the premium build and the expectation ke usko easily 4 saal nikaal loon (this is why I am a little reluctant to get the Redmi). Can anyone guide me? Any other phone suggestions are also welcome, thank you!",theunknownsexy,https://www.reddit.com/r/PakistaniTech/comments/1kp3cog/galaxy_a55_or_redmi_note_14_pro/
2a749590d3d9bbf8,Reddit,discussion,2025-05-17T20:50:34+00:00,,looking for new music!!!,"show me your FAVORITE songs, maybe I’ll give my thoughts idk",Ch103_E09,https://www.reddit.com/r/spotify/comments/1kp2z6r/looking_for_new_music/
5801bfd0de7129c5,Reddit,discussion,2025-05-17T20:48:15+00:00,,Spaghetti,"Here's a little playlist I made with music from Italian western movies from the 60s-70s. It's meant to be played without shuffle, from the top. Preferably with crossfade set to a couple of seconds, at least. If you're interested in ""no shuffle- playlists"" I've got some on my profile. I've marked them with a star in the list title.",TheHappyNerfHerder,https://www.reddit.com/r/spotify/comments/1kp2xet/spaghetti/
7028622bf9ee74d5,Reddit,discussion,2025-05-17T19:49:08+00:00,,For the people who uses 'X' on Spotify - did it also get sassy with you today ?,"Spotify recently had an update I guess where you can request a song on the X DJ feature. Well I skipped a few songs in a row and X said ""my friend you are dominating that skip button. If there's something you want to hear then just let me know."" I couldn't believe it 😂 it made giggle cause it felt like being at a club and the dj getting annoyed with you.",Capybara-909,https://www.reddit.com/r/spotify/comments/1kp1m7q/for_the_people_who_uses_x_on_spotify_did_it_also/
8d7218efca965143,Reddit,discussion,2025-05-17T19:41:30+00:00,,I have free Spotify is there a way I can shuffle my playlist with only the songs that I put on the playlist and not the recommend,I have free Spotify is there a way I can shuffle my playlist with only the songs that I put on the playlist and not the recommend,Own-Structure4311,https://www.reddit.com/r/truespotify/comments/1kp1g1s/i_have_free_spotify_is_there_a_way_i_can_shuffle/
d4cbcbe58d4345f7,Reddit,discussion,2025-05-17T19:04:36+00:00,,Help me find anthem/cinematic-style songs!,"I’m looking for anthemic, cinematic tracks that fuse folk, rock, and EDM. Imagine a medieval rave with a pounding, heavy bass LOL. Here are the songs I have on my list SB19- DAM [https://open.spotify.com/track/7qD9Q4xBpJpnDLNYGxGmIk?si=2ecf0074cf26449e](https://open.spotify.com/track/7qD9Q4xBpJpnDLNYGxGmIk?si=2ecf0074cf26449e) Woodkid- Iron (Remix) [https://open.spotify.com/track/1C58O2IBDSX3zCjQzBZllw?si=152c7e765e704c44](https://open.spotify.com/track/1C58O2IBDSX3zCjQzBZllw?si=152c7e765e704c44)",vettang,https://www.reddit.com/r/spotify/comments/1kp0l9c/help_me_find_anthemcinematicstyle_songs/
41f139e773e85ba9,Reddit,discussion,2025-05-17T18:46:11+00:00,,"The free version so atrocious, it’s not even worth using.","I'm probably going to get flooded with downvotes from people saying ""if you can afford a phone or computer you can afford premium,"" but it's actually impressive how bad Spotify basic is. You can't listen to full songs, you can't see song icons, random songs are forced onto your playlists, there are ads every 3 seconds, etc etc. As a music app, Spotify basic is an order of magnitude worse than YouTube. Atleast YouTube lets you listen to full songs (Spotify basic only lets you listen to full songs if your lucky and they play when listening to a playlist.) I get that if it was as good as premium then nobody would buy premium, but the basic version is so bad I'd rather just use YouTube or even Apple Music then spend nearly 150 dollars every year.",Extra_Fall_8474,https://www.reddit.com/r/truespotify/comments/1kp05zi/the_free_version_so_atrocious_its_not_even_worth/
